{
  "$schema": "https://json-schema.org/draft/2020-12/schema",
  "$id": "urn:agentos:schema:mcp-worker-receive-result",
  "title": "AgentOS MCP Worker Receive Result",
  "description": "Returns an at-least-once batch of Worker Messages for the current execution attempt.",
  "type": "object",
  "additionalProperties": false,
  "required": [
    "workerId",
    "assignmentId",
    "attemptId",
    "messages",
    "nextCursor"
  ],
  "properties": {
    "workerId": {
      "$ref": "urn:agentos:schema:worker-common#/$defs/identifier"
    },
    "assignmentId": {
      "$ref": "urn:agentos:schema:worker-common#/$defs/identifier"
    },
    "attemptId": {
      "$ref": "urn:agentos:schema:worker-common#/$defs/identifier"
    },
    "messages": {
      "type": "array",
      "items": {
        "$ref": "urn:agentos:schema:worker-message"
      }
    },
    "nextCursor": {
      "$ref": "urn:agentos:schema:worker-common#/$defs/identifier"
    },
    "retryAfterMs": {
      "type": "integer",
      "minimum": 0,
      "maximum": 60000
    }
  }
}
