{
  "workerId": "worker-research-a",
  "assignmentId": "assignment-research-a",
  "attemptId": "attempt-research-a-1",
  "messages": [
    {
      "messageId": "message-peer-evidence-1",
      "workerId": "worker-research-a",
      "assignmentId": "assignment-research-a",
      "inputBinding": "sha256:example-input-binding",
      "kind": "peer_evidence",
      "source": {
        "kind": "worker",
        "id": "worker-research-b"
      },
      "payloadSchemaRef": "urn:example:schema:peer-evidence",
      "payload": {
        "summary": "Alternative analysis found a recovery edge case.",
        "evidence": [
          "The current design does not reconcile an uncertain side effect before retry."
        ]
      }
    }
  ],
  "nextCursor": "cursor-2"
}
